{
  "schemaVersion": 1,
  "runId": "recipes-create-breadcrumbs",
  "sequence": 7,
  "from": "open-pr",
  "to": "open-pr",
  "outcome": "blocked",
  "artifacts": ["spec.md", "plan.md"],
  "evidence": [
    "Ready-for-review PR description is prepared locally.",
    "GitHub CLI is authenticated and the local feature branch is clean."
  ],
  "findings": [
    "Automatic approval review rejected pushing the private repository source to origin because the user has not explicitly authorized this payload and destination. Waiting for human authorization to push branch feat/recipes-create-breadcrumbs to github.com/gbabiars/recipe-vault."
  ],
  "attempt": 1
}
