{
  "schemaVersion": 1,
  "runId": "recipes-create-breadcrumbs",
  "sequence": 8,
  "from": "open-pr",
  "to": "human-review",
  "outcome": "pass",
  "artifacts": ["spec.md", "plan.md"],
  "evidence": [
    "Ready-for-review PR #3 opened: https://github.com/gbabiars/recipe-vault/pull/3.",
    "At handoff time, quality and database CI jobs were queued and Vercel was pending."
  ],
  "findings": [],
  "attempt": 1
}
