{
  "schemaVersion": 1,
  "runId": "recipes-live-filters",
  "sequence": 11,
  "from": "open-pr",
  "to": "human-review",
  "outcome": "pass",
  "artifacts": ["spec.md", "plan.md"],
  "evidence": [
    "Ready-for-review pull request opened: https://github.com/gbabiars/recipe-vault/pull/2.",
    "The PR description includes the accepted behavior, verification evidence, and workflow run directory."
  ],
  "findings": [],
  "attempt": 1
}
