{
  "schemaVersion": 1,
  "runId": "recipes-create-breadcrumbs",
  "sequence": 6,
  "from": "review",
  "to": "open-pr",
  "outcome": "pass",
  "artifacts": [],
  "evidence": [
    "Fresh read-only review found no defects; implementation matches the approved breadcrumb pattern, preserves authentication and form behavior, and covers the real page with role-based assertions.",
    "Focused Playwright-backed page component test passed; pnpm lint and pnpm typecheck passed.",
    "Storybook MCP test-run remained unavailable due to an internal Vitest Orchestrator not found error before test execution.",
    "Next.js runtime inspection was not run because agent-browser is not installed, a required next-dev-loop preflight dependency."
  ],
  "findings": [],
  "attempt": 1
}
