{
  "schemaVersion": 1,
  "runId": "recipes-live-filters",
  "sequence": 15,
  "from": "verify-fix",
  "to": "review",
  "outcome": "pass",
  "artifacts": ["spec.md", "plan.md"],
  "evidence": [
    "A queue of pending self-initiated filter URLs prevents older route props from overwriting newer local edits or canceling their debounce.",
    "Browser regression tests pass for debounced search focus, real tag-selection focus, overlapping route updates, and external route synchronization.",
    "Focused browser component tests passed: recipe filters (9), tag filter (5), and recipes page (2); 16 tests total.",
    "pnpm lint passed.",
    "pnpm typecheck passed.",
    "All four affected Storybook stories passed individually with accessibility checks enabled.",
    "pnpm workflow:validate workflows/recipes-live-filters passed."
  ],
  "findings": [],
  "attempt": 1
}
