{
  "schemaVersion": 1,
  "runId": "recipes-live-filters",
  "sequence": 9,
  "from": "verify-fix",
  "to": "review",
  "outcome": "pass",
  "artifacts": ["spec.md", "plan.md"],
  "evidence": [
    "Focused browser component tests passed: recipe filters, tag filter, and recipes page; 12 tests total.",
    "pnpm lint passed.",
    "pnpm typecheck passed.",
    "All four affected Storybook stories passed individually with accessibility checks enabled.",
    "pnpm workflow:validate workflows/recipes-live-filters passed."
  ],
  "findings": [],
  "attempt": 1
}
