{
  "schemaVersion": 1,
  "runId": "recipes-live-filters",
  "sequence": 13,
  "from": "verify-fix",
  "to": "review",
  "outcome": "pass",
  "artifacts": ["spec.md", "plan.md"],
  "evidence": [
    "The focus-loss regression was reproduced before the fix and now passes for both search and tag controls, including a debounced search URL update with trailing input whitespace preserved.",
    "Focused browser component tests passed: recipe filters (7), tag filter (5), and recipes page (2); 14 tests total.",
    "pnpm lint passed.",
    "pnpm typecheck passed.",
    "All four affected Storybook stories passed individually with accessibility checks enabled.",
    "pnpm workflow:validate workflows/recipes-live-filters passed."
  ],
  "findings": [],
  "attempt": 1
}
