{
  "schemaVersion": 1,
  "runId": "recipes-live-filters",
  "sequence": 12,
  "from": "human-review",
  "to": "verify-fix",
  "outcome": "return",
  "artifacts": ["spec.md", "plan.md"],
  "evidence": [
    "Human review on PR 2 reported that search and tag inputs lose focus after URL updates: https://github.com/gbabiars/recipe-vault/pull/2#issuecomment-6043267485.",
    "A focused browser regression test reproduced the focus loss when route filter props changed."
  ],
  "findings": [
    "Preserve focus in the input that triggered a search or tag query update while synchronizing route changes."
  ],
  "attempt": 1
}
